{
  "schema_version": "1.0.0",
  "type": "product",
  "id": "https://example.com/products/sku-ABC123",
  "source_url": "https://example.com/store/sku-ABC123",
  "title": "Acme SmartWidget 2",
  "language": "en",
  "summary": "A compact, battery-efficient smart widget with Bluetooth 5.3 and IP67 rating.",
  "tags": ["electronics", "widget"],
  "last_modified": "2025-08-24T11:00:00Z",
  "content_version": "2.0.1",
  "page_checksum": "z9c8b7a6T5s4r3q2p1o0n9m8l7k6j5i4h3g2f1e0d=",
  "license": "CC-BY-4.0",
  "publisher": { "name": "Example Store", "url": "https://example.com" },
  "content": {
    "sku": "ABC123",
    "gtin": "0012345678905",
    "brand": "Acme",
    "category": "Electronics > Gadgets",
    "description": "Acme SmartWidget 2 brings...",
    "features": ["Bluetooth 5.3", "IP67", "12h battery"],
    "price": 129.99,
    "currency": "USD",
    "availability": "in_stock",
    "inventory": 428,
    "condition": "new",
    "images": [
      { "url": "https://example.com/images/sku-ABC123/front.png", "alt": "Front view" },
      { "url": "https://example.com/images/sku-ABC123/back.png", "alt": "Back view" }
    ],
    "dimensions": { "width": 80, "height": 40, "depth": 8, "unit": "mm" },
    "weight": { "value": 120, "unit": "g" },
    "rating": 4.6,
    "variants": [
      { "sku": "ABC123-BLK", "title": "Black", "attributes": { "color": "black" }, "price": 129.99, "availability": "in_stock" },
      { "sku": "ABC123-RED", "title": "Red", "attributes": { "color": "red" }, "price": 129.99, "availability": "out_of_stock" }
    ]
  }
}

